{
  "address": "Kildega rdsvej 12, 5792 A rslev",
  "building_center": {
    "x": 5.648774768726448,
    "y": -0.02114923332469673,
    "z": -1.0383230859948194
  },
  "ceiling": [
    {
      "arrangement_cell_id": null,
      "corners": [
        {
          "x": 3.8007,
          "y": 0.7676,
          "z": -6.0145
        },
        {
          "x": 1.0014,
          "y": 0.7676,
          "z": -6.8419
        },
        {
          "x": -0.4066,
          "y": 0.7676,
          "z": -2.0784
        },
        {
          "x": 2.3734,
          "y": 0.7676,
          "z": -1.1857
        }
      ],
      "holes": [],
      "locator_id": "29a9cb5c-e7e7-4a01-b8ed-b2a2dd0edd2a::tier-ceiling-flat::0",
      "plane": {
        "a": -0.0,
        "b": 1.0,
        "c": -0.0,
        "d": 0.7676
      },
      "source": "flat_emit"
    },
    {
      "arrangement_cell_id": null,
      "corners": [
        {
          "x": 7.998,
          "y": 1.2592999999999999,
          "z": 0.9519
        },
        {
          "x": 5.7459,
          "y": 1.2592999999999996,
          "z": 0.2862
        },
        {
          "x": 4.9866,
          "y": 1.2593000000000003,
          "z": 2.8551
        },
        {
          "x": 7.2387,
          "y": 1.2593000000000005,
          "z": 3.5207
        }
      ],
      "holes": [],
      "locator_id": "29a9cb5c-e7e7-4a01-b8ed-b2a2dd0edd2a::tier-ceiling-flat::1",
      "plane": {
        "a": -0.0,
        "b": 1.0,
        "c": -2.2204460492503136e-16,
        "d": 1.2592999999999996
      },
      "source": "flat_emit"
    },
    {
      "arrangement_cell_id": null,
      "corners": [
        {
          "x": 5.663,
          "y": 1.3859999999999997,
          "z": 0.2323
        },
        {
          "x": 7.1208,
          "y": 1.3859999999999997,
          "z": 0.6632
        },
        {
          "x": 8.2478,
          "y": 1.3859999999999997,
          "z": -3.15
        },
        {
          "x": 6.7971,
          "y": 1.3859999999999997,
          "z": -3.5788
        },
        {
          "x": 6.7406,
          "y": 1.3859999999999997,
          "z": -3.3877
        },
        {
          "x": 5.5266,
          "y": 1.3859999999999997,
          "z": -3.7466
        },
        {
          "x": 3.4365,
          "y": 1.3859999999999997,
          "z": -4.3644
        },
        {
          "x": 1.5925,
          "y": 1.3859999999999997,
          "z": 1.8744
        },
        {
          "x": 4.8896,
          "y": 1.3859999999999997,
          "z": 2.8489
        }
      ],
      "holes": [],
      "locator_id": "29a9cb5c-e7e7-4a01-b8ed-b2a2dd0edd2a::tier-ceiling-flat::2",
      "plane": {
        "a": 0.0,
        "b": 1.0,
        "c": -0.0,
        "d": 1.3859999999999997
      },
      "source": "flat_emit"
    },
    {
      "arrangement_cell_id": null,
      "corners": [
        {
          "x": 11.2901,
          "y": 1.3601,
          "z": 0.8446
        },
        {
          "x": 7.4768,
          "y": 1.3601,
          "z": -0.2825
        },
        {
          "x": 7.2019,
          "y": 1.3601,
          "z": 0.6477
        },
        {
          "x": 8.0512,
          "y": 1.3601,
          "z": 0.8988
        },
        {
          "x": 7.2528,
          "y": 1.3601,
          "z": 3.5998
        },
        {
          "x": 10.2168,
          "y": 1.3601,
          "z": 4.4759
        }
      ],
      "holes": [],
      "locator_id": "29a9cb5c-e7e7-4a01-b8ed-b2a2dd0edd2a::tier-ceiling-flat::3",
      "plane": {
        "a": 0.0,
        "b": 1.0,
        "c": 0.0,
        "d": 1.3601
      },
      "source": "flat_emit"
    },
    {
      "arrangement_cell_id": null,
      "corners": [
        {
          "x": 12.1696,
          "y": 1.3622000000000003,
          "z": -1.9725
        },
        {
          "x": 8.33,
          "y": 1.3622000000000005,
          "z": -3.1074
        },
        {
          "x": 7.6942,
          "y": 1.3622,
          "z": -0.9563
        },
        {
          "x": 11.5338,
          "y": 1.3621999999999999,
          "z": 0.1786
        }
      ],
      "holes": [],
      "locator_id": "29a9cb5c-e7e7-4a01-b8ed-b2a2dd0edd2a::tier-ceiling-flat::4",
      "plane": {
        "a": 0.0,
        "b": 1.0,
        "c": 2.2204460492503136e-16,
        "d": 1.3621999999999999
      },
      "source": "flat_emit"
    },
    {
      "arrangement_cell_id": null,
      "corners": [
        {
          "x": 13.621,
          "y": 1.3601,
          "z": -6.9268
        },
        {
          "x": 8.1948,
          "y": 1.3601,
          "z": -8.5307
        },
        {
          "x": 6.7504,
          "y": 1.3601,
          "z": -3.644
        },
        {
          "x": 12.1766,
          "y": 1.3601,
          "z": -2.0401
        }
      ],
      "holes": [],
      "locator_id": "29a9cb5c-e7e7-4a01-b8ed-b2a2dd0edd2a::tier-ceiling-flat::5",
      "plane": {
        "a": 0.0,
        "b": 1.0,
        "c": 0.0,
        "d": 1.3601
      },
      "source": "flat_emit"
    },
    {
      "arrangement_cell_id": null,
      "corners": [
        {
          "x": 1.5379,
          "y": 0.7603999999999999,
          "z": 1.8993
        },
        {
          "x": 1.7415,
          "y": 0.7603999999999999,
          "z": 1.2107
        },
        {
          "x": 1.9729,
          "y": 0.7603999999999999,
          "z": 0.4916
        },
        {
          "x": 2.2566,
          "y": 0.7603999999999999,
          "z": -0.4684
        },
        {
          "x": 2.0829,
          "y": 0.7603999999999999,
          "z": -0.5198
        },
        {
          "x": 2.2732,
          "y": 0.7603999999999999,
          "z": -1.1636
        },
        {
          "x": 0.3963,
          "y": 0.7603999999999999,
          "z": -1.7184
        },
        {
          "x": 0.4239,
          "y": 0.7603999999999999,
          "z": -1.8117
        },
        {
          "x": 0.13924978668971258,
          "y": 0.7603999999999999,
          "z": -1.9031193868424796
        },
        {
          "x": -0.31840603423674524,
          "y": 0.7603999999999999,
          "z": -2.0500795851665976
        },
        {
          "x": -1.2428,
          "y": 0.7603999999999999,
          "z": 1.0773
        }
      ],
      "holes": [],
      "locator_id": "29a9cb5c-e7e7-4a01-b8ed-b2a2dd0edd2a::tier-ceiling-flat::6",
      "plane": {
        "a": -0.0,
        "b": 1.0,
        "c": -0.0,
        "d": 0.7603999999999999
      },
      "source": "flat_emit"
    }
  ],
  "classification": {
    "has_gable": false,
    "has_half_height": false,
    "n_flat": 9,
    "n_oblique": 0,
    "n_rooms": 7,
    "n_stories": 1,
    "roof_type": "none",
    "tier": 1,
    "tier_label": "1 storey \u00b7 flat"
  },
  "gaps": [
    {
      "corners": [
        {
          "x": 2.010071494998221,
          "y": -1.244342954398674,
          "z": -1.3023798152516113
        },
        {
          "x": 1.993482681655132,
          "y": -1.244342954398674,
          "z": -1.2462571692287996
        },
        {
          "x": 1.993482681655132,
          "y": 1.3601115192092779,
          "z": -1.2462571692287996
        },
        {
          "x": 2.010071494998221,
          "y": 1.3601115192092779,
          "z": -1.3023798152516113
        }
      ],
      "kind": "side",
      "locator_id": "29a9cb5c-e7e7-4a01-b8ed-b2a2dd0edd2a::tier-gap::gw:gap:within_story:0:ffc85b8a22fe398b:within_story:edge:1",
      "scope": "intra_story"
    },
    {
      "corners": [
        {
          "x": 2.1460937273495557,
          "y": -1.244342954398674,
          "z": -0.7335568827035912
        },
        {
          "x": 2.3444921154466916,
          "y": -1.244342954398674,
          "z": -0.669849707157256
        },
        {
          "x": 2.3444921154466916,
          "y": 1.3601115192092779,
          "z": -0.669849707157256
        },
        {
          "x": 2.1460937273495557,
          "y": 1.3601115192092779,
          "z": -0.7335568827035912
        }
      ],
      "kind": "side",
      "locator_id": "29a9cb5c-e7e7-4a01-b8ed-b2a2dd0edd2a::tier-gap::gw:gap:within_story:0:ffc85b8a22fe398b:within_story:edge:4",
      "scope": "intra_story"
    },
    {
      "corners": [
        {
          "x": 3.4365218734919365,
          "y": -1.244342954398674,
          "z": -4.364363491211794
        },
        {
          "x": 3.3228984577005716,
          "y": -1.244342954398674,
          "z": -4.397948412198058
        },
        {
          "x": 3.3228984577005716,
          "y": 1.3472598192092782,
          "z": -4.397948412198058
        },
        {
          "x": 3.4365218734919365,
          "y": 1.3472598192092782,
          "z": -4.364363491211794
        }
      ],
      "kind": "side",
      "locator_id": "29a9cb5c-e7e7-4a01-b8ed-b2a2dd0edd2a::tier-gap::gw:gap:within_story:0:ffc85b8a22fe398b:within_story:edge:6",
      "scope": "intra_story"
    },
    {
      "corners": [
        {
          "x": 2.373419044350685,
          "y": -1.2443429543986737,
          "z": -1.185706255889854
        },
        {
          "x": 2.010071494998221,
          "y": -1.2443429543986737,
          "z": -1.3023798152516113
        },
        {
          "x": 1.993482681655132,
          "y": -1.2443429543986737,
          "z": -1.2462571692287996
        },
        {
          "x": 2.273199874142666,
          "y": -1.2443429543986737,
          "z": -1.1635779010584382
        },
        {
          "x": 2.1460937273495557,
          "y": -1.2443429543986737,
          "z": -0.7335568827035912
        },
        {
          "x": 2.3444921154466916,
          "y": -1.2443429543986737,
          "z": -0.669849707157256
        },
        {
          "x": 3.4365218734919365,
          "y": -1.2443429543986737,
          "z": -4.364363491211794
        },
        {
          "x": 3.3228984577005716,
          "y": -1.2443429543986737,
          "z": -4.397948412198058
        }
      ],